{
  "$defs": {
    "artifactRef": {
      "additionalProperties": false,
      "properties": {
        "digest": {
          "pattern": "^sha256:[0-9a-f]{64}$",
          "type": "string"
        },
        "id": {
          "minLength": 1,
          "type": "string"
        }
      },
      "required": [
        "id",
        "digest"
      ],
      "type": "object"
    },
    "metadata": {
      "additionalProperties": false,
      "properties": {
        "fixture_only": {
          "type": "boolean"
        },
        "note": {
          "type": "string"
        }
      },
      "type": "object"
    }
  },
  "$id": "engineering-system/human-decision/m0-v1",
  "$schema": "https://json-schema.org/draft/2020-12/schema",
  "additionalProperties": false,
  "properties": {
    "decision": {
      "enum": [
        "ACCEPT",
        "REJECT",
        "REQUEST_REVISION"
      ]
    },
    "human_decision_id": {
      "type": "string"
    },
    "metadata": {
      "$ref": "#/$defs/metadata"
    },
    "patch_ref": {
      "$ref": "#/$defs/artifactRef"
    },
    "plan_ref": {
      "$ref": "#/$defs/artifactRef"
    },
    "recorded_at": {
      "format": "date-time",
      "type": "string"
    },
    "result_state_digest": {
      "pattern": "^sha256:[0-9a-f]{64}$",
      "type": "string"
    },
    "review_ref": {
      "$ref": "#/$defs/artifactRef"
    },
    "schema": {
      "const": "engineering-system/human-decision/m0-v1"
    },
    "semantic_digest": {
      "pattern": "^sha256:[0-9a-f]{64}$",
      "type": "string"
    }
  },
  "required": [
    "schema",
    "human_decision_id",
    "semantic_digest",
    "plan_ref",
    "patch_ref",
    "review_ref",
    "result_state_digest",
    "decision",
    "recorded_at"
  ],
  "type": "object"
}
